<?xml version="1.0" encoding="UTF-8"?>
<world  xmlns:xsi="http://www.w3.org/2001/XMLSchema-instance"
        xsi:noNamespaceSchemaLocation="world.xsd">

    <people>人妖</people>
    <testplmn>
        <test1>test1</test1>
        <test2>test2</test2>
        <testcase1>testcase1</testcase1>

        <test1>test1</test1>
        <test2>test2</test2>
        <testcase1>testcase1</testcase1>

        <testset2>testcase2</testset2>
    </testplmn>
    <plant>glass</plant>
    <Inanimate_body></Inanimate_body>


</world>
